{
  "id": "focus",
  "name": "Focus",
  "description": "Lists and Mail are hidden, the title bar, status bar and side panel are closed, and new chats start at low reasoning effort.",
  "version": "1.0.0",
  "apiVersion": 1,
  "kind": "profile",
  "enabled": false,
  "contributes": {
    "layout": { "titlebar": false, "statusbar": false, "sidepanel": false },
    "defaults": {
      "views": { "todos": false, "mail": false },
      "effort": "low"
    }
  }
}
