{
  "id": "lean",
  "name": "Lean",
  "description": "Lists, Calendar, Mail, Health, LaTeX and Canvases start off. Turn any of them on under Settings > Sidebar.",
  "version": "1.0.0",
  "apiVersion": 1,
  "kind": "profile",
  "enabled": false,
  "contributes": {
    "defaults": {
      "views": { "todos": false, "calendar": false, "mail": false, "health": false, "spaces": false, "claude-code": false, "latex": false }
    }
  }
}
